,row_id,academic_subject,reporting_category,teks_number,grade_levels,teks_text,aware_text,teks_id,teks_display_path
80,1424,English,Oral and Written Conventions/Spelling,110.14.b.24.B.ii,3,"dropping final ""e"" when endings are added (e.g., -ing, -ed);","spell words with more advanced orthographic patterns and rules dropping final ""e"" when endings are added (e.g., -ing, -ed).",157822,110.14.24.Bii
81,1425,English,Oral and Written Conventions/Spelling,110.14.b.24.B.iii,3,changing y to i before adding an ending;,spell words with more advanced orthographic patterns and rules changing y to i before adding an ending.,157823,110.14.24.Biii
82,1426,English,Oral and Written Conventions/Spelling,110.14.b.24.B.iv,3,double consonants in middle of words;,spell words with more advanced orthographic patterns and rules double consonants in middle of words.,157824,110.14.24.Biv
83,1427,English,Oral and Written Conventions/Spelling,110.14.b.24.B.v,3,"complex consonants (e.g., scr-, -dge, -tch); and","spell words with more advanced orthographic patterns and rules complex consonants (e.g., scr-, -dge, -tch).",157825,110.14.24.Bv
84,1428,English,Oral and Written Conventions/Spelling,110.14.b.24.B.vi,3,"abstract vowels (e.g., ou as in could, touch, through, bought);","spell words with more advanced orthographic patterns and rules abstract vowels (e.g., ou as in could, touch, through, bought).",157826,110.14.24.Bvi
85,1429,English,Oral and Written Conventions/Spelling,110.14.b.24.C,3,spell high-frequency and compound words from a commonly used list;,spell high-frequency and compound words from a commonly used list.,157827,110.14.24.C
86,1430,English,Oral and Written Conventions/Spelling,110.14.b.24.D,3,"spell words with common syllable constructions (e.g., closed, open, final stable syllable);","spell words with common syllable constructions (e.g., closed, open, final stable syllable).",157828,110.14.24.D
87,1431,English,Oral and Written Conventions/Spelling,110.14.b.24.E,3,"spell single syllable homophones (e.g., bear/bare; week/weak; road/rode);","spell single syllable homophones (e.g., bear/bare; week/weak; road/rode).",157829,110.14.24.E
88,1432,English,Oral and Written Conventions/Spelling,110.14.b.24.F,3,"spell complex contractions (e.g., should've, won't); and","spell complex contractions (e.g., should've, won't).",157830,110.14.24.F
89,1433,English,Oral and Written Conventions/Spelling,110.14.b.24.G,3,use print and electronic resources to find and check correct spellings.,use print and electronic resources to find and check correct spellings.,157831,110.14.24.G
90,1434,English,Research/Research Plan,110.14.b.25,3,Research/Research Plan. Students ask open-ended research questions and develop a plan for answering them. Students are expected to:,Research/Research Plan. Students ask open-ended research questions and develop a plan for answering them.,175518,110.14.25
91,1435,English,Research/Research Plan,110.14.b.25.A,3,"generate research topics from personal interests or by brainstorming with others, narrow to one topic, and formulate open-ended questions about the major research topic; and","generate research topics from personal interests or by brainstorming with others, narrow to one topic, and formulate open-ended questions about the major research topic.",157832,110.14.25.A
92,1436,English,Research/Research Plan,110.14.b.25.B,3,"generate a research plan for gathering relevant information (e.g., surveys, interviews, encyclopedias) about the major research question.","generate a research plan for gathering relevant information (e.g., surveys, interviews, encyclopedias) about the major research question.",157833,110.14.25.B
93,1437,English,Research/Gathering Sources,110.14.b.26,3,"Research/Gathering Sources. Students determine, locate, and explore the full range of relevant sources addressing a research question and systematically record the information they gather. Students are expected to:","Research/Gathering Sources. Students determine, locate, and explore the full range of relevant sources addressing a research question and systematically record the information they gather.",175519,110.14.26
94,1438,English,Research/Gathering Sources,110.14.b.26.A,3,"follow the research plan to collect information from multiple sources of information, both oral and written, including:","follow the research plan to collect information from multiple sources of information, both oral and written, including",175797,110.14.26.A
95,1439,English,Research/Gathering Sources,110.14.b.26.A.i,3,"student-initiated surveys, on-site inspections, and interviews;","follow the research plan to collect information from multiple sources of information, both oral and written, including student-initiated surveys, on-site inspections, and interviews.",157834,110.14.26.Ai
96,1440,English,Research/Gathering Sources,110.14.b.26.A.ii,3,"data from experts, reference texts, and online searches; and","follow the research plan to collect information from multiple sources of information, both oral and written, including data from experts, reference texts, and online searches.",157835,110.14.26.Aii
97,1441,English,Research/Gathering Sources,110.14.b.26.A.iii,3,"visual sources of information (e.g., maps, timelines, graphs) where appropriate;","follow the research plan to collect information from multiple sources of information, both oral and written, including visual sources of information (e.g., maps, timelines, graphs) where appropriate.",157836,110.14.26.Aiii
98,1442,English,Research/Gathering Sources,110.14.b.26.B,3,"use skimming and scanning techniques to identify data by looking at text features (e.g., bold print, captions, key words, italics);","use skimming and scanning techniques to identify data by looking at text features (e.g., bold print, captions, key words, italics).",157837,110.14.26.B
99,1443,English,Research/Gathering Sources,110.14.b.26.C,3,take simple notes and sort evidence into provided categories or an organizer;,take simple notes and sort evidence into provided categories or an organizer.,157838,110.14.26.C
100,1444,English,Research/Gathering Sources,110.14.b.26.D,3,"identify the author, title, publisher, and publication year of sources; and","identify the author, title, publisher, and publication year of sources.",157839,110.14.26.D
101,1445,English,Research/Gathering Sources,110.14.b.26.E,3,differentiate between paraphrasing and plagiarism and identify the importance of citing valid and reliable sources.,differentiate between paraphrasing and plagiarism and identify the importance of citing valid and reliable sources.,157840,110.14.26.E
102,1446,English,Research/Synthesizing Information,110.14.b.27,3,"Research/Synthesizing Information. Students clarify research questions and evaluate and synthesize collected information. Students are expected to improve the focus of research as a result of consulting expert sources (e.g., reference librarians and local experts on the topic).","improve the focus of research as a result of consulting expert sources (e.g., reference librarians and local experts on the topic).",157841,110.14.27.A
103,1447,English,Research/Organizing and Presenting Ideas,110.14.b.28,3,"Research/Organizing and Presenting Ideas. Students organize and present their ideas and information according to the purpose of the research and their audience. Students are expected to draw conclusions through a brief written explanation and create a works-cited page from notes, including the author, title, publisher, and publication year for each source used.",draw conclusions through a brief written explanation and create a works-cited,157842,110.14.28.A
104,1448,English,Listening and Speaking/Listening,110.14.b.29,3,Listening and Speaking/Listening. Students use comprehension skills to listen attentively to others in formal and informal settings. Students continue to apply earlier standards with greater complexity. Students are expected to:,Listening and Speaking/Listening. Students use comprehension skills to listen attentively to others in formal and informal settings. Students continue to apply earlier standards with greater complexity.,175522,110.14.29
105,1449,English,Listening and Speaking/Listening,110.14.b.29.A,3,"listen attentively to speakers, ask relevant questions, and make pertinent comments; and","listen attentively to speakers, ask relevant questions, and make pertinent comments.",157843,110.14.29.A
106,1450,English,Listening and Speaking/Listening,110.14.b.29.B,3,"follow, restate, and give oral instructions that involve a series of related sequences of action.","follow, restate, and give oral instructions that involve a series of related sequences of action.",157844,110.14.29.B
107,1350,English,Reading/Fluency,110.14.b.3,3,"Reading/Fluency. Students read grade-level text with fluency and comprehension. Students are expected to read aloud grade-level appropriate text with fluency (rate, accuracy, expression, appropriate phrasing) and comprehension.","read aloud grade-level appropriate text with fluency (rate, accuracy, expression, appropriate phrasing) and comprehension.",157762,110.14.3.A
108,1451,English,Listening and Speaking/Speaking,110.14.b.30,3,"Listening and Speaking/Speaking. Students speak clearly and to the point, using the conventions of language. Students continue to apply earlier standards with greater complexity. Students are expected to speak coherently about the topic under discussion, employing eye contact, speaking rate, volume, enunciation, and the conventions of language to communicate ideas effectively.","speak coherently about the topic under discussion, employing eye contact, speaking rate, volume, enunciation, and the conventions of language to communicate ideas effectively.",157845,110.14.30.A
109,1452,English,Listening and Speaking/Teamwork,110.14.b.31,3,Listening and Speaking/Teamwork. Students work productively with others in teams. Students continue to apply earlier standards with greater complexity. Students are expected to participate in teacher- and student-led discussions by posing and answering questions with appropriate detail and by providing suggestions that build upon the ideas of others.,participate in teacher- and student-led discussions by posing and answering questions with appropriate detail and by providing suggestions that build upon the ideas of others.,157846,110.14.31.A
110,1351,English,Reading/Vocabulary Development,110.14.b.4,3,Reading/Vocabulary Development. Students understand new vocabulary and use it when reading and writing. Students are expected to:,Reading/Vocabulary Development. Students understand new vocabulary and use it when reading and writing.,175526,110.14.4
111,1352,English,Reading/Vocabulary Development,110.14.b.4.A,3,"identify the meaning of common prefixes (e.g., in-, dis-) and suffixes (e.g., -full, -less), and know how they change the meaning of roots;","identify the meaning of common prefixes (e.g., ing-, dis-) and suffixes (e.g., -full, -less), and know how they change the meaning of roots.",157763,110.14.4.A
112,1353,English,Reading/Vocabulary Development,110.14.b.4.B,3,use context to determine the relevant meaning of unfamiliar words or distinguish among multiple meaning words and homographs;,use context to determine the relevant meaning of unfamiliar words or distinguish among multiple meaning words and homographs.,157764,110.14.4.B
113,1354,English,Reading/Vocabulary Development,110.14.b.4.C,3,"identify and use antonyms, synonyms, homographs, and homophones;","identify and use antonyms, synonyms, homographs, and homophones.",157765,110.14.4.C
114,1355,English,Reading/Vocabulary Development,110.14.b.4.D,3,"identify and apply playful uses of language (e.g., tongue twisters, palindromes, riddles); and","identify and apply playful uses of language (e.g., tongue twisters, palindromes, riddles).",157766,110.14.4.D
115,1356,English,Reading/Vocabulary Development,110.14.b.4.E,3,"alphabetize a series of words to the third letter and use a dictionary or a glossary to determine the meanings, syllabication, and pronunciation of unknown words.","alphabetize a series of words to the third letter and use a dictionary or a glossary to determine the meanings, syllabication, and pronunciation of unknown words.",157767,110.14.4.E
116,1357,English,Reading/Comprehension of Literary Text/Theme and Genre,110.14.b.5,3,"Reading/Comprehension of Literary Text/Theme and Genre. Students analyze, make inferences and draw conclusions about theme and genre in different cultural, historical, and contemporary contexts and provide evidence from the text to support their understanding. Students are expected to:","Reading/Comprehension of Literary Text/Theme and Genre. Students analyze, make inferences and draw conclusions about theme and genre in different cultural, historical, and contemporary contexts and provide evidence from the text to support their understanding.",175527,110.14.5
117,1358,English,Reading/Comprehension of Literary Text/Theme and Genre,110.14.b.5.A,3,"paraphrase the themes and supporting details of fables, legends, myths, or stories; and","paraphrase the themes and supporting details of fables, legends, myths, or stories.",157768,110.14.5.A
118,1359,English,Reading/Comprehension of Literary Text/Theme and Genre,110.14.b.5.B,3,compare and contrast the settings in myths and traditional folktales.,compare and contrast the settings in myths and traditional folktales.,157769,110.14.5.B
119,1360,English,Reading/Comprehension of Literary Text/Poetry,110.14.b.6,3,"Reading/Comprehension of Literary Text/Poetry. Students understand, make inferences and draw conclusions about the structure and elements of poetry and provide evidence from text to support their understanding. Students are expected to describe the characteristics of various forms of poetry and how they create imagery (e.g., narrative poetry, lyrical poetry, humorous poetry, free verse).","describe the characteristics of various forms of poetry and how they create imagery (e.g., narrative poetry, lyrical poetry, humorous poetry, free verse).",157770,110.14.6.A
120,1363,English,Reading/Comprehension of Literary Text/Drama,110.14.b.7,3,"Reading/Comprehension of Literary Text/Drama. Students understand, make inferences and draw conclusions about the structure and elements of drama and provide evidence from text to support their understanding. Students are expected to explain the elements of plot and character as presented through dialogue in scripts that are read, viewed, written, or performed.","explain the elements of plot  and character as presented through dialogue in scripts that are read, viewed, written, or performed.",157771,110.14.7.A
121,1364,English,Reading/Comprehension of Literary Text/Fiction,110.14.b.8,3,"Reading/Comprehension of Literary Text/Fiction. Students understand, make inferences and draw conclusions about the structure and elements of fiction and provide evidence from text to support their understanding. Students are expected to:","Reading/Comprehension of Literary Text/Fiction. Students understand, make inferences and draw conclusions about the structure and elements of fiction and provide evidence from text to support their understanding.",175530,110.14.8
122,1361,English,Reading/Comprehension of Literary Text/Fiction,110.14.b.8.A,3,sequence and summarize the plot's main events and explain their influence on future events;,sequence and summarize the plot's main events and explain their influence on future events.,157772,110.14.8.A
123,1362,English,Reading/Comprehension of Literary Text/Fiction,110.14.b.8.B,3,describe the interaction of characters including their relationships and the changes they undergo; and,describe the interaction of characters including their relationships and the changes they undergo.,157773,110.14.8.B
124,1343,English,Reading/Comprehension of Literary Text/Fiction,110.14.b.8.C,3,identify whether the narrator or speaker of a story is first or third person.,identify whether the narrator or speaker of a story is first or third person.,157774,110.14.8.C
125,1365,English,Reading/Comprehension of Literary Text/Literary Nonfiction,110.14.b.9,3,"Reading/Comprehension of Literary Text/Literary Nonfiction. Students understand, make inferences and draw conclusions about the varied structural patterns and features of literary nonfiction and respond by providing evidence from text to support their understanding. Students are expected to explain the difference in point of view between a biography and autobiography.",explain the difference in point of view between a biography and autobiography.,157775,110.14.9.A
