,row_id,academic_subject,reporting_category,teks_number,grade_levels,teks_text,aware_text,teks_id,teks_display_path
0,1327,English,Reading/Beginning Reading Skills/Phonics,110.14.b.1,3,"Reading/Beginning Reading Skills/Phonics. Students use the relationships between letters and sounds, spelling patterns, and morphological analysis to decode written English. Students are expected to:","Reading/Beginning Reading Skills/Phonics. Students use the relationships between letters and sounds, spelling patterns, and morphological analysis to decode written English.",175501,110.14.1
1,1328,English,Reading/Beginning Reading Skills/Phonics,110.14.b.1.A,3,decode multisyllabic words in context and independent of context by applying common spelling patterns including:,decode multisyllabic words in context and independent of context by applying common spelling patterns including,175790,110.14.1.A
2,1329,English,Reading/Beginning Reading Skills/Phonics,110.14.b.1.A.i,3,"dropping the final ""e"" and add endings such as -ing, -ed, or -able (e.g., use, using, used, usable);","decode multisyllabic words in context and independent of context by applying common spelling patterns including dropping the final ""e"" and add endings such as -ing, -ed, or -able (e.g., use, using, used, usable).",157746,110.14.1.Ai
3,1330,English,Reading/Beginning Reading Skills/Phonics,110.14.b.1.A.ii,3,"doubling final consonants when adding an ending (e.g., hop to hopping);","decode multisyllabic words in context and independent of context by applying common spelling patterns including doubling final consonants when adding an ending (e.g., hop to hopping).",157747,110.14.1.Aii
4,1331,English,Reading/Beginning Reading Skills/Phonics,110.14.b.1.A.iii,3,"changing the final ""y"" to ""i"" (e.g., baby to babies);","decode multisyllabic words in context and independent of context by applying common spelling patterns including changing the final ""y"" to ""i"" (e.g., baby to babies).",157748,110.14.1.Aiii
5,1332,English,Reading/Beginning Reading Skills/Phonics,110.14.b.1.A.iv,3,"using knowledge of common prefixes and suffixes (e.g., dis-, -ly); and","decode multisyllabic words in context and independent of context by applying common spelling patterns including using knowledge of common prefixes and suffixes (e.g., dis-, -ly).",157749,110.14.1.Aiv
6,1333,English,Reading/Beginning Reading Skills/Phonics,110.14.b.1.A.v,3,"using knowledge of derivational affixes (e.g., -de, -ful, -able);","decode multisyllabic words in context and independent of context by applying common spelling patterns including using knowledge of derivational affixes (e.g., -de, -ful, -able).",157750,110.14.1.Av
7,1334,English,Reading/Beginning Reading Skills/Phonics,110.14.b.1.B,3,use common syllabication patterns to decode words including:,use common syllabication patterns to decode words including,175791,110.14.1.B
8,1335,English,Reading/Beginning Reading Skills/Phonics,110.14.b.1.B.i,3,"closed syllable (CVC) (e.g., mag-net, splen-did);","use common syllabication patterns to decode words including closed syllable (CVC) (e.g., mag-net, splen-did).",157751,110.14.1.Bi
9,1336,English,Reading/Beginning Reading Skills/Phonics,110.14.b.1.B.ii,3,"open syllable (CV) (e.g., ve-to);","use common syllabication patterns to decode words including open syllable (CV) (e.g., ve-to).",157752,110.14.1.Bii
10,1337,English,Reading/Beginning Reading Skills/Phonics,110.14.b.1.B.iii,3,"final stable syllable (e.g., puz-zle, con-trac-tion);","use common syllabication patterns to decode words including final stable syllable (e.g., puz-zle, con-trac-tion).",157753,110.14.1.Biii
11,1338,English,Reading/Beginning Reading Skills/Phonics,110.14.b.1.B.iv,3,"r-controlled vowels (e.g., fer-ment, car-pool); and","use common syllabication patterns to decode words including r-controlled vowels (e.g., fer-ment, car-pool).",157754,110.14.1.Biv
12,1339,English,Reading/Beginning Reading Skills/Phonics,110.14.b.1.B.v,3,"vowel digraphs and diphthongs (e.g., ei-ther);","use common syllabication patterns to decode words including vowel digraphs and diphthongs (e.g., ei-ther).",157755,110.14.1.Bv
13,1340,English,Reading/Beginning Reading Skills/Phonics,110.14.b.1.C,3,"decode words applying knowledge of common spelling patterns (e.g., -eigh, -ought);","decode words applying knowledge of common spelling patterns (e.g., -eigh, -ought).",157756,110.14.1.C
14,1341,English,Reading/Beginning Reading Skills/Phonics,110.14.b.1.D,3,"identify and read contractions (e.g., I'd, won't); and","identify and read contractions (e.g., I'd, won't).",157757,110.14.1.D
15,1342,English,Reading/Beginning Reading Skills/Phonics,110.14.b.1.E,3,monitor accuracy in decoding.,monitor accuracy in decoding.,157758,110.14.1.E
16,1366,English,Reading/Comprehension of Literary Text/Sensory Language,110.14.b.10,3,"Reading/Comprehension of Literary Text/Sensory Language. Students understand, make inferences and draw conclusions about how an author's sensory language creates imagery in literary text and provide evidence from text to support their understanding. Students are expected to identify language that creates a graphic visual experience and appeals to the senses.",identify language that creates a graphic visual experience and appeals to the senses.,157776,110.14.10.A
17,1367,English,Reading/Comprehension of Text/Independent Reading,110.14.b.11,3,"Reading/Comprehension of Text/Independent Reading. Students read independently for sustained periods of time and produce evidence of their reading. Students are expected to read independently for a sustained period of time and paraphrase what the reading was about, maintaining meaning and logical order (e.g., generate a reading log or journal; participate in book talks).","read independently for a sustained period of time and paraphrase what the reading was about, maintaining meaning and logical order (e.g., generate a reading log or journal; participate in book talks).",157777,110.14.11.A
18,1368,English,Reading/Comprehension of Informational Text/Culture and History,110.14.b.12,3,"Reading/Comprehension of Informational Text/Culture and History. Students analyze, make inferences and draw conclusions about the author's purpose in cultural, historical, and contemporary contexts and provide evidence from the text to support their understanding. Students are expected to identify the topic and locate the author's stated purposes in writing the text.",identify the topic and locate the author's stated purposes in writing the text.,157778,110.14.12.A
19,1369,English,Reading/Comprehension of Informational Text/Expository Text,110.14.b.13,3,"Reading/Comprehension of Informational Text/Expository Text. Students analyze, make inferences and draw conclusions about expository text and provide evidence from text to support their understanding. Students are expected to:","Reading/Comprehension of Informational Text/Expository Text. Students analyze, make inferences and draw conclusions about expository text and provide evidence from text to support their understanding.",175505,110.14.13
20,1344,English,Reading/Comprehension of Informational Text/Expository Text,110.14.b.13.A,3,identify the details or facts that support the main idea;,identify the details or facts that support the main idea.,157779,110.14.13.A
21,1345,English,Reading/Comprehension of Informational Text/Expository Text,110.14.b.13.B,3,draw conclusions from the facts presented in text and support those assertions with textual evidence;,draw conclusions from the facts presented in text and support those assertions with textual evidence.,157780,110.14.13.B
22,1370,English,Reading/Comprehension of Informational Text/Expository Text,110.14.b.13.C,3,identify explicit cause and effect relationships among ideas in texts; and,identify explicit cause and effect relationships among ideas in texts.,157781,110.14.13.C
23,1371,English,Reading/Comprehension of Informational Text/Expository Text,110.14.b.13.D,3,"use text features (e.g., bold print, captions, key words, italics) to locate information and make and verify predictions about contents of text.","use text features (e.g., bold print, captions, key words, italics) to locate information and make and verify predictions about contents of text.",157782,110.14.13.D
24,1376,English,Reading/Comprehension of Informational Text/Persuasive Text,110.14.b.14,3,"Reading/Comprehension of Informational Text/Persuasive Text. Students analyze, make inferences and draw conclusions about persuasive text and provide evidence from text to support their analysis. Students are expected to identify what the author is trying to persuade the reader to think or do.",identify what the author is trying to persuade the reader to think or do.,157783,110.14.14.A
25,1377,English,Reading/Comprehension of Informational Text/Procedural Texts,110.14.b.15,3,Reading/Comprehension of Informational Text/Procedural Texts. Students understand how to glean and use information in procedural texts and documents. Students are expected to:,Reading/Comprehension of Informational Text/Procedural Texts. Students understand how to glean and use information in procedural texts and documents.,175507,110.14.15
26,1378,English,Reading/Comprehension of Informational Text/Procedural Texts,110.14.b.15.A,3,follow and explain a set of written multi-step directions; and,follow and explain a set of written multi-step directions.,157784,110.14.15.A
27,1379,English,Reading/Comprehension of Informational Text/Procedural Texts,110.14.b.15.B,3,locate and use specific information in graphic features of text.,locate and use specific information in graphic features of text.,157785,110.14.15.B
28,1380,English,Reading/Media Literacy,110.14.b.16,3,"Reading/Media Literacy. Students use comprehension skills to analyze how words, images, graphics, and sounds work together in various forms to impact meaning. Students will continue to apply earlier standards with greater depth in increasingly more complex texts. Students are expected to:","Reading/Media Literacy. Students use comprehension skills to analyze how words, images, graphics, and sounds work together in various forms to impact meaning. Students will continue to apply earlier standards with greater depth in increasingly more complex texts.",175508,110.14.16
29,1381,English,Reading/Media Literacy,110.14.b.16.A,3,understand how communication changes when moving from one genre of media to another;,understand how communication changes when moving from one genre of media to another.,157786,110.14.16.A
30,1382,English,Reading/Media Literacy,110.14.b.16.B,3,"explain how various design techniques used in media influence the message (e.g., shape, color, sound); and","explain how various design techniques used in media influence the message (e.g., shape, color, sound).",157787,110.14.16.B
31,1383,English,Reading/Media Literacy,110.14.b.16.C,3,"compare various written conventions used for digital media (e.g., language in an informal e-mail vs. language in a web-based news article).","compare various written conventions used for digital media (e.g., language in an informal e-mail vs. language in a web-based news article).",157788,110.14.16.C
32,1384,English,Writing/Writing Process,110.14.b.17,3,"Writing/Writing Process. Students use elements of the writing process (planning, drafting, revising, editing, and publishing) to compose text. Students are expected to:","Writing/Writing Process. Students use elements of the writing process (planning, drafting, revising, editing, and publishing) to compose text.",175509,110.14.17
33,1385,English,Writing/Writing Process,110.14.b.17.A,3,"plan a first draft by selecting a genre appropriate for conveying the intended meaning to an audience and generating ideas through a range of strategies (e.g., brainstorming, graphic organizers, logs, journals);","plan a first draft by selecting a genre appropriate for conveying the intended meaning to an audience and generating ideas through a range of strategies (e.g., brainstorming, graphic organizers, logs, journals).",157789,110.14.17.A
34,1386,English,Writing/Writing Process,110.14.b.17.B,3,develop drafts by categorizing ideas and organizing them into paragraphs;,develop drafts by categorizing ideas and organizing them into paragraphs.,157790,110.14.17.B
35,1387,English,Writing/Writing Process,110.14.b.17.C,3,"revise drafts for coherence, organization, use of simple and compound sentences, and audience;","revise drafts for coherence, organization, use of simple and compound sentences, and audience.",157791,110.14.17.C
36,1388,English,Writing/Writing Process,110.14.b.17.D,3,"edit drafts for grammar, mechanics, and spelling using a teacher-developed rubric; and","edit drafts for grammar, mechanics, and spelling using a teacher-developed rubric.",157792,110.14.17.D
37,1389,English,Writing/Writing Process,110.14.b.17.E,3,publish written work for a specific audience.,publish written work for a specific audience.,157793,110.14.17.E
38,1390,English,Writing/Literary Texts,110.14.b.18,3,"Writing/Literary Texts. Students write literary texts to express their ideas and feelings about real or imagined people, events, and ideas. Students are expected to:","Writing/Literary Texts. Students write literary texts to express their ideas and feelings about real or imagined people, events, and ideas.",175510,110.14.18
39,1391,English,Writing/Literary Texts,110.14.b.18.A,3,write imaginative stories that build the plot to a climax and contain details about the characters and setting; and,write imaginative stories that build the plot to a climax and contain details about the characters and setting.,157794,110.14.18.A
40,1392,English,Writing/Literary Texts,110.14.b.18.B,3,"write poems that convey sensory details using the conventions of poetry (e.g., rhyme, meter, patterns of verse).","write poems that convey sensory details using the conventions of poetry (e.g., rhyme, meter, patterns of verse).",157795,110.14.18.B
41,1393,English,Writing,110.14.b.19,3,Writing. Students write about their own experiences. Students are expected to write about important personal experiences.,write about important personal experiences.,157796,110.14.19.A
42,1346,English,Reading/Beginning Reading/Strategies,110.14.b.2,3,Reading/Beginning Reading/Strategies. Students comprehend a variety of texts drawing on useful strategies as needed. Students are expected to:,Reading/Beginning Reading/Strategies. Students comprehend a variety of texts drawing on useful strategies as needed.,175512,110.14.2
43,1347,English,Reading/Beginning Reading/Strategies,110.14.b.2.A,3,"use ideas (e.g., illustrations, titles, topic sentences, key words, and foreshadowing clues) to make and confirm predictions;","use ideas (e.g., illustrations, titles, topic sentences, key words, and foreshadowing clues) to make and confirm predictions.",157759,110.14.2.A
44,1348,English,Reading/Beginning Reading/Strategies,110.14.b.2.B,3,"ask relevant questions, seek clarification, and locate facts and details about stories and other texts and support answers with evidence from text; and","ask relevant questions, seek clarification, and locate facts and details about stories and other texts and support answers with evidence from text.",157760,110.14.2.B
45,1349,English,Reading/Beginning Reading/Strategies,110.14.b.2.C,3,"establish purpose for reading selected texts and monitor comprehension, making corrections and adjustments when that understanding breaks down (e.g., identifying clues, using background knowledge, generating questions, re-reading a portion aloud).","establish purpose for reading selected texts and monitor comprehension, making corrections and adjustments when that understanding breaks down (e.g., identifying clues, using background knowledge, generating questions, re-reading a portion aloud).",157761,110.14.2.C
46,1397,English,Writing/Expository and Procedural Texts,110.14.b.20,3,Writing/Expository and Procedural Texts. Students write expository and procedural or work-related texts to communicate ideas and information to specific audiences for specific purposes. Students are expected to:,Writing/Expository and Procedural Texts. Students write expository and procedural or work-related texts to communicate ideas and information to specific audiences for specific purposes.,175513,110.14.20
47,1394,English,Writing/Expository and Procedural Texts,110.14.b.20.A,3,create brief compositions that:,create brief compositions that,175792,110.14.20.A
48,1395,English,Writing/Expository and Procedural Texts,110.14.b.20.A.i,3,establish a central idea in a topic sentence;,create brief compositions that establish a central idea in a topic sentence.,157797,110.14.20.Ai
49,1396,English,Writing/Expository and Procedural Texts,110.14.b.20.A.ii,3,"include supporting sentences with simple facts, details, and explanations; and","create brief compositions that include supporting sentences with simple facts, details, and explanations.",157798,110.14.20.Aii
50,1398,English,Writing/Expository and Procedural Texts,110.14.b.20.A.iii,3,contain a concluding statement;,create brief compositions that contain a concluding statement.,157799,110.14.20.Aiii
51,1399,English,Writing/Expository and Procedural Texts,110.14.b.20.B,3,"write letters whose language is tailored to the audience and purpose (e.g., a thank you note to a friend) and that use appropriate conventions (e.g., date, salutation, closing); and","write letters whose language is tailored to the audience and purpose (e.g., a thank you note to a friend) and that use appropriate conventions (e.g., date, salutation, closing).",157800,110.14.20.B
52,1400,English,Writing/Expository and Procedural Texts,110.14.b.20.C,3,write responses to literary or expository texts that demonstrate an understanding of the text.,write responses to literary or expository texts that demonstrate an understanding of the text.,157801,110.14.20.C
53,1401,English,Writing/Persuasive Texts,110.14.b.21,3,Writing/Persuasive Texts. Students write persuasive texts to influence the attitudes or actions of a specific audience on specific issues. Students are expected to write persuasive essays for appropriate audiences that establish a position and use supporting details.,write persuasive essays for appropriate audiences that establish a position and use supporting details.,157802,110.14.21.A
54,1402,English,Oral and Written Conventions/Conventions,110.14.b.22,3,Oral and Written Conventions/Conventions. Students understand the function of and use the conventions of academic language when speaking and writing. Students continue to apply earlier standards with greater complexity. Students are expected to:,Oral and Written Conventions/Conventions. Students understand the function of and use the conventions of academic language when speaking and writing. Students continue to apply earlier standards with greater complexity.,175515,110.14.22
55,1403,English,Oral and Written Conventions/Conventions,110.14.b.22.A,3,"use and understand the function of the following parts of speech in the context of reading, writing, and speaking:","use and understand the function of the following parts of speech in the context of reading, writing, and speaking",175793,110.14.22.A
56,1404,English,Oral and Written Conventions/Conventions,110.14.b.22.A.i,3,"verbs (past, present, and future);","use and understand the function of the following parts of speech in the context of reading, writing, and speaking verbs (past, present, and future).",157803,110.14.22.Ai
57,1405,English,Oral and Written Conventions/Conventions,110.14.b.22.A.ii,3,"nouns (singular/plural, common/proper);","use and understand the function of the following parts of speech in the context of reading, writing, and speaking nouns (singular/plural, common/proper).",157804,110.14.22.Aii
58,1406,English,Oral and Written Conventions/Conventions,110.14.b.22.A.iii,3,"adjectives (e.g., descriptive: wooden, rectangular; limiting: this, that; articles: a, an, the);","use and understand the function of the following parts of speech in the context of reading, writing, and speaking adjectives (e.g., descriptive: wooden, rectangular; limiting: this, that; articles: a, an, the).",157805,110.14.22.Aiii
59,1407,English,Oral and Written Conventions/Conventions,110.14.b.22.A.iv,3,"adverbs (e.g., time: before, next; manner: carefully, beautifully);","use and understand the function of the following parts of speech in the context of reading, writing, and speaking adverbs (e.g., time: before, next; manner: carefully, beautifully).",157806,110.14.22.Aiv
60,1408,English,Oral and Written Conventions/Conventions,110.14.b.22.A.v,3,prepositions and prepositional phrases;,"use and understand the function of the following parts of speech in the context of reading, writing, and speaking prepositions and prepositional phrases.",157807,110.14.22.Av
61,1409,English,Oral and Written Conventions/Conventions,110.14.b.22.A.vi,3,"possessive pronouns (e.g., his, hers, theirs);","use and understand the function of the following parts of speech in the context of reading, writing, and speaking possessive pronouns (e.g., his, hers, theirs).",157808,110.14.22.Avi
62,1410,English,Oral and Written Conventions/Conventions,110.14.b.22.A.vii,3,"coordinating conjunctions (e.g., and, or, but); and","use and understand the function of the following parts of speech in the context of reading, writing, and speaking coordinating conjunctions (e.g., and, or, but).",157809,110.14.22.Avii
63,1411,English,Oral and Written Conventions/Conventions,110.14.b.22.A.viii,3,time-order transition words and transitions that indicate a conclusion;,"use and understand the function of the following parts of speech in the context of reading, writing, and speaking time-order transition words and transitions that indicate a conclusion.",157810,110.14.22.Aviii
64,1412,English,Oral and Written Conventions/Conventions,110.14.b.22.B,3,use the complete subject and the complete predicate in a sentence; and,use the complete subject and the complete predicate in a sentence.,157811,110.14.22.B
65,1413,English,Oral and Written Conventions/Conventions,110.14.b.22.C,3,use complete simple and compound sentences with correct subject-verb agreement.,use complete simple and compound sentences with correct subject-verb agreement.,157812,110.14.22.C
66,1414,English,"Oral and Written Conventions/Handwriting, Capitalization, and Punctuation",110.14.b.23,3,"Oral and Written Conventions/Handwriting, Capitalization, and Punctuation. Students write legibly and use appropriate capitalization and punctuation conventions in their compositions. Students are expected to:","Oral and Written Conventions/Handwriting, Capitalization, and Punctuation. Students write legibly and use appropriate capitalization and punctuation conventions in their compositions.",175516,110.14.23
67,1415,English,"Oral and Written Conventions/Handwriting, Capitalization, and Punctuation",110.14.b.23.A,3,write legibly in cursive script with spacing between words in a sentence;,write legibly in cursive script with spacing between words in a sentence.,157813,110.14.23.A
68,1416,English,"Oral and Written Conventions/Handwriting, Capitalization, and Punctuation",110.14.b.23.B,3,use capitalization for:,use capitalization for,175794,110.14.23.B
69,1417,English,"Oral and Written Conventions/Handwriting, Capitalization, and Punctuation",110.14.b.23.B.i,3,geographical names and places;,use capitalization for geographical names and places.,157814,110.14.23.Bi
70,1418,English,"Oral and Written Conventions/Handwriting, Capitalization, and Punctuation",110.14.b.23.B.ii,3,historical periods; and,use capitalization for historical periods.,157815,110.14.23.Bii
71,1372,English,"Oral and Written Conventions/Handwriting, Capitalization, and Punctuation",110.14.b.23.B.iii,3,official titles of people;,use capitalization for official titles of people.,157816,110.14.23.Biii
72,1373,English,"Oral and Written Conventions/Handwriting, Capitalization, and Punctuation",110.14.b.23.C,3,recognize and use punctuation marks including:,recognize and use punctuation marks including,175795,110.14.23.C
73,1374,English,"Oral and Written Conventions/Handwriting, Capitalization, and Punctuation",110.14.b.23.C.i,3,apostrophes in contractions and possessives; and,recognize and use punctuation marks including apostrophes in contractions and possessives.,157817,110.14.23.Ci
74,1375,English,"Oral and Written Conventions/Handwriting, Capitalization, and Punctuation",110.14.b.23.C.ii,3,commas in series and dates; and,recognize and use punctuation marks including commas in series and dates.,157818,110.14.23.Cii
75,1419,English,"Oral and Written Conventions/Handwriting, Capitalization, and Punctuation",110.14.b.23.D,3,use correct mechanics including paragraph indentations.,use correct mechanics including paragraph indentations.,157819,110.14.23.D
76,1420,English,Oral and Written Conventions/Spelling,110.14.b.24,3,Oral and Written Conventions/Spelling. Students spell correctly. Students are expected to:,Oral and Written Conventions/Spelling. Students spell correctly.,175517,110.14.24
77,1421,English,Oral and Written Conventions/Spelling,110.14.b.24.A,3,"use knowledge of letter sounds, word parts, word segmentation, and syllabication to spell;","use knowledge of letter sounds, word parts, word segmentation, and syllabication to spell.",157820,110.14.24.A
78,1422,English,Oral and Written Conventions/Spelling,110.14.b.24.B,3,spell words with more advanced orthographic patterns and rules:,spell words with more advanced orthographic patterns and rules,175796,110.14.24.B
79,1423,English,Oral and Written Conventions/Spelling,110.14.b.24.B.i,3,consonant doubling when adding an ending;,spell words with more advanced orthographic patterns and rules consonant doubling when adding an ending.,157821,110.14.24.Bi
